SQL> select * from emp;

        ID NAME                                                                 
---------- --------------------                                                 
         1 a                                                                    
         2 b                                                                    
         3 c                                                                    
         4 d                                                                    
         5 e                                                                    

SQL> insert into emp values(6,'f');

1 row created.

SQL> commit;

Commit complete.

SQL> select * from emp;

        ID NAME                                                                 
---------- --------------------                                                 
         1 a                                                                    
         2 b                                                                    
         3 c                                                                    
         4 d                                                                    
         5 e                                                                    
         6 f                                                                    

6 rows selected.

SQL> update emp set name='x' where id=3;

1 row updated.

SQL> savepoint A;

Savepoint created.

SQL> insert into emp values(7,'g');

1 row created.

SQL> savepoint B;

Savepoint created.

SQL> select * from emp;

        ID NAME                                                                 
---------- --------------------                                                 
         1 a                                                                    
         2 b                                                                    
         3 x                                                                    
         4 d                                                                    
         5 e                                                                    
         6 f                                                                    
         7 g                                                                    

7 rows selected.

SQL> rollback to B;

Rollback complete.

SQL> select * from emp;

        ID NAME                                                                 
---------- --------------------                                                 
         1 a                                                                    
         2 b                                                                    
         3 x                                                                    
         4 d                                                                    
         5 e                                                                    
         6 f                                                                    
         7 g                                                                    

7 rows selected.

SQL> rollback to A;

Rollback complete.

SQL> select * from emp;

        ID NAME                                                                 
---------- --------------------                                                 
         1 a                                                                    
         2 b                                                                    
         3 x                                                                    
         4 d                                                                    
         5 e                                                                    
         6 f                                                                    

6 rows selected.

SQL> spool off
